{
  "schema_version": 2,
  "release_id": "880fb7af338833bd261f99cfe68c87202b8cc2fda7615b0a3e54b0794b077f5b",
  "promoted_at": "2026-07-13T16:30:00Z",
  "config": {
    "key": "aws-public-change-alerting/releases/880fb7af338833bd261f99cfe68c87202b8cc2fda7615b0a3e54b0794b077f5b/config.yaml",
    "version_id": "example-config-version-id",
    "sha256": "9fa91cd2c7f0b8280d94c27c9843f951bf3005820d918a7c03bd7806e5cc1a70",
    "schema_version": 4
  },
  "inventory": {
    "key": "aws-public-change-alerting/releases/880fb7af338833bd261f99cfe68c87202b8cc2fda7615b0a3e54b0794b077f5b/inventory.json",
    "version_id": "example-inventory-version-id",
    "sha256": "00b84f7cc404fb7740fe778387eac40327511b6b94439beec46f51f383cb93f1",
    "schema_version": 3
  }
}
